{
  "specversion": "1.0",
  "id": "c9a1e2b3-d4f5-6789-0abc-def123456789",
  "type": "dev.complytime.evidence.ingested",
  "source": "complytime-gateway",
  "subject": "my-app-v1",
  "time": "2026-08-20T14:30:00Z",
  "datacontenttype": "application/json",
  "data": {
    "contentDigest": "sha256:2cf24dba5fb0a30e26e83b2ac5b9e29e1b161e5c1fa7425e73043362938b9824",
    "artifactType": "application/vnd.gemara.evaluation-log+json",
    "storageRef": "store/evidence/2026/08/20/c9a1e2b3",
    "subjectId": "my-app-v1",
    "shardId": "shard-west-1"
  }
}
